{
  "schemaVersion": 2,
  "name": "NyaLauncher Plugins",
  "sourceUrl": "https://github.com/TouristH/NyaLauncher-Plugins",
  "minimumLauncherVersion": "0.1.2-testplug.1",
  "plugins": [
    {
      "id": "io.github.touristh.clock",
      "name": "电子时钟示例",
      "description": "显示当前电脑时间的电子钟组件，可切换 24/12 小时制并控制时区和秒的显示。",
      "authors": [
        "TouristH"
      ],
      "repositoryUrl": "https://github.com/redstore-noob/NyaLauncher",
      "maintainers": [
        "TouristH"
      ],
      "categories": [
        "utilities"
      ],
      "license": "MIT",
      "lineageId": "dc538577-8d88-50e4-ba9e-10620bc5ba10",
      "generation": 1,
      "lifecycleStatus": "retired",
      "visibility": "hidden",
      "publisher": {
        "repositoryId": 1317097635,
        "ownerId": 206107690
      },
      "generations": [
        {
          "generation": 1,
          "repositoryUrl": "https://github.com/redstore-noob/NyaLauncher",
          "repositoryUrlHistory": [
            "https://github.com/redstore-noob/NyaLauncher"
          ],
          "publisher": {
            "repositoryId": 1317097635,
            "ownerId": 206107690
          },
          "status": "retired"
        }
      ],
      "releases": [
        {
          "generation": 1,
          "version": "1.1.0",
          "channel": "stable",
          "publishedAt": "2026-08-13T12:28:11Z",
          "releaseNotesUrl": "https://github.com/redstore-noob/NyaLauncher/releases/tag/clock-v1.1.0",
          "download": {
            "url": "https://github.com/redstore-noob/NyaLauncher/releases/download/clock-v1.1.0/io.github.touristh.clock-1.1.0.zip",
            "sha256": "36f554001f0eb1d222de0b0cf80029a9c47043e110e4f437312d428418f0578e",
            "size": 14534
          },
          "compatibility": {
            "manifestVersion": 1,
            "apiVersion": "1.0",
            "minimumLauncherVersion": "0.1.1"
          },
          "requiredCapabilities": [
            "ui.components",
            "system.info.read"
          ],
          "optionalCapabilities": [],
          "yanked": true,
          "yankReason": "固定 GitHub Release ZIP 资产不存在（HTTP 404，2026-08-20 确认）。"
        },
        {
          "generation": 1,
          "version": "1.0.0",
          "channel": "stable",
          "publishedAt": "2026-08-13T11:59:52Z",
          "releaseNotesUrl": "https://github.com/redstore-noob/NyaLauncher/releases/tag/clock-v1.0.0",
          "download": {
            "url": "https://github.com/redstore-noob/NyaLauncher/releases/download/clock-v1.0.0/io.github.touristh.clock-1.0.0.zip",
            "sha256": "81f2dcd8edae7f63d1f6cb40c5e5ff9ecfddf196b6f540749775a2dbac7b56df",
            "size": 14046
          },
          "compatibility": {
            "manifestVersion": 1,
            "apiVersion": "1.0",
            "minimumLauncherVersion": "0.1.0"
          },
          "requiredCapabilities": [
            "ui.components",
            "system.info.read"
          ],
          "optionalCapabilities": [],
          "yanked": true,
          "yankReason": "固定 GitHub Release ZIP 资产不存在（HTTP 404，2026-08-20 确认）。"
        }
      ]
    },
    {
      "id": "io.github.touristh.example-clock",
      "name": "电子时钟示例",
      "description": "显示当前电脑时间的电子钟组件，可切换 24/12 小时制并控制时区和秒的显示。",
      "authors": [
        "TouristH"
      ],
      "repositoryUrl": "https://github.com/TouristH/NyaLauncher.Clock",
      "maintainers": [
        "TouristH"
      ],
      "categories": [
        "utilities"
      ],
      "license": "MIT",
      "lineageId": "9d0f81a3-4f25-5699-ac57-ece4c106e045",
      "generation": 1,
      "lifecycleStatus": "active",
      "visibility": "listed",
      "publisher": {
        "repositoryId": 1341064957,
        "ownerId": 143396778
      },
      "generations": [
        {
          "generation": 1,
          "repositoryUrl": "https://github.com/TouristH/NyaLauncher.Clock",
          "repositoryUrlHistory": [
            "https://github.com/TouristH/NyaLauncher.Clock"
          ],
          "publisher": {
            "repositoryId": 1341064957,
            "ownerId": 143396778
          },
          "status": "active"
        }
      ],
      "releases": [
        {
          "generation": 1,
          "version": "1.0.0",
          "channel": "stable",
          "publishedAt": "2026-08-20T19:34:00Z",
          "releaseNotesUrl": "https://github.com/TouristH/NyaLauncher.Clock/releases/tag/v1.0.0",
          "download": {
            "url": "https://github.com/TouristH/NyaLauncher.Clock/releases/download/v1.0.0/io.github.touristh.example-clock-1.0.0.zip",
            "sha256": "6ed02d5a11096efd625ea1bc92e8e8d9991620854ed203246e05c7c84cdb7f1a",
            "size": 14185
          },
          "compatibility": {
            "manifestVersion": 1,
            "apiVersion": "1.0",
            "minimumLauncherVersion": "0.1.1"
          },
          "requiredCapabilities": [
            "ui.components",
            "system.info.read"
          ],
          "optionalCapabilities": [],
          "yanked": false
        }
      ]
    }
  ]
}
